{
  "$contract": "soter://contracts/change-set/v1",
  "contractVersion": "1.0.0",
  "id": "changeset.meeting-intake.transaction-fixture",
  "runId": "run.meeting-intake.transaction-fixture",
  "createdAt": "2026-07-15T12:00:00.000Z",
  "configurationLockFingerprint": "sha256:b9b3024a94333576a7ac111445e05eeb286bc67e822b5dd745b40353b489c2ee",
  "basis": {
    "kind": "automation-decision",
    "id": "decision.meeting-intake.transaction-fixture",
    "fingerprint": "sha256:b7965e736ec797a3e1c4ef289e159fa6255df68018340ca1aaa29ed2c5777b2d",
    "contextSnapshotId": "context.meeting-intake.transaction-fixture",
    "contextSnapshotFingerprint": "sha256:5bdb026c473b03e10eb478fc40b5b940a2883d4d13651f4efc440f3606c70e20"
  },
  "state": "committed",
  "scopeFingerprint": "sha256:053a26d559847747b24774dc7f8988bbdfcbacab7288e1973506b5c22712da20",
  "operations": [
    {
      "id": "operation.task.update",
      "capability": "crm.records.update",
      "authority": "authority.crm.instance",
      "reason": "The bounded fixture transcript explicitly requests the existing launch-deck work.",
      "input": {
        "recordType": "task",
        "id": "soter-fixture://crm/task/existing-deck",
        "expectedVersion": "1",
        "patch": {
          "context": "Meeting"
        }
      },
      "inputFingerprint": "sha256:b63d7115d37ee8dca7af5e1883b4a54ef8adfc3b41fc31accda1ee8b59f8a0c1",
      "state": "passed",
      "effectId": "effect.meeting-intake.transaction-fixture.task.update",
      "outputFingerprint": "sha256:a38da2933c2e71c19fd1dee785464eb559b4580c1740543d0c83b6d9fa283310",
      "error": null
    },
    {
      "id": "operation.summary.create",
      "capability": "crm.records.create",
      "authority": "authority.crm.instance",
      "reason": "Create the exact transcript-cited summary selected by decision.meeting-intake.transaction-fixture.",
      "input": {
        "recordType": "meeting-summary",
        "deduplicationKey": "otter://fixture/meeting.fixture-001",
        "deduplicationFilter": {
          "field": "link",
          "value": "otter://fixture/meeting.fixture-001"
        },
        "fields": {
          "title": "Acme launch review summary",
          "documentType": "Meeting Summary",
          "description": "The launch direction is approved. Please send the updated deck Friday. I will revise the deck and link it to the launch project.",
          "link": "otter://fixture/meeting.fixture-001"
        },
        "body": "Maya Chen: The launch direction is approved. Please send the updated deck Friday.\n\nRetro: I will revise the deck and link it to the launch project."
      },
      "inputFingerprint": "sha256:b559a7c5cd430d811b988b1f4c7ade9dfdb43185da9cded57841a6f66766a087",
      "state": "passed",
      "effectId": "effect.meeting-intake.transaction-fixture.summary.create",
      "outputFingerprint": "sha256:516c48fd733016bb8931f41fc1c8ed0f0f751ef7fd7342008c1373e72ccc9010",
      "error": null
    }
  ],
  "approvalId": "approval.meeting-intake.transaction-fixture",
  "transaction": {
    "checkpointFingerprint": "sha256:8977ac9a36bdc84cc6dc0e134c3fd19fc9e08b38e9574412aee17d47d195fe71",
    "state": "committed",
    "rollbackState": "not-required",
    "restoredFingerprint": null
  },
  "verification": {
    "state": "passed",
    "effectId": "effect.meeting-intake.transaction-fixture.verify",
    "criteria": [
      "Exactly one meeting summary exists for the canonical recording link.",
      "The summary body and link remain attributable to the source transcript and recording.",
      "The existing overlapping task is classified as meeting-derived without duplication."
    ],
    "observedFingerprint": "sha256:110f8c17e1ba4204706511f9d616289c1dc9ebfff6fcb62e0a87818e5a88aa4d"
  }
}
